[
  {
    "schema_version": "article.v2",
    "external_id": "kunkurcomputer-data-information-technology-1405-report-cards",
    "content_type": "article",
    "title": "ارشد فناوری اطلاعات (آی‌تی): رتبه‌های زیر ۱۰۰ در ۱۴۰۵ چند زدند و ۱۴۰۶ چه فرقی دارد؟",
    "slug": "information-technology-1405-report-cards",
    "summary": "۴۲ کارنامهٔ رتبه‌های زیر ۱۰۰ ارشد فناوری اطلاعات ۱۴۰۵ را بررسی کردیم: در هر دسته‌درس چند زدند، با درس مدیریت چه کردند و دو کد ضریب آی‌تی چقدر فرق داشت. بعد دیدیم ساختار تازهٔ ۱۴۰۶ این عددها را چطور عوض می‌کند.",
    "quick_answer": "در ۱۴۰۵، رتبه‌های زیر ۱۰ ارشد فناوری اطلاعات در سهمیهٔ آزاد میانهٔ حدود ۷۱ درصد در زبان، ۳۹ درصد در دروس مشترک و ۴۷ درصد در تخصصی داشتند و مدیریت را تقریباً صفر زده بودند. از ۴۲ رتبهٔ زیر ۱۰۰، ۳۰ نفر در مدیریت صفر یا منفی داشتند. در ۱۴۰۶ مدیریت در فهرست مواد ۱۲۷۶ نیست: آزمون سه بسته دارد، زبان با ضریب ۱، ریاضیات (گسسته و آمار و احتمال) با ضریب ۲ و بستهٔ تخصصی شامل مبانی برنامه‌سازی، داده‌ساختار و الگوریتم، سیستم عامل، شبکه، پایگاه داده و هوش مصنوعی با ضریب ۴.",
    "content_blocks": [
      {
        "type": "text",
        "text": "بیشتر تحلیل‌های کارنامه مال مهندسی کامپیوترند و داوطلب فناوری اطلاعات معمولاً عدد مخصوص خودش را پیدا نمی‌کند. اینجا فقط کارنامه‌های مجموعهٔ ۱۲۷۶ را آورده‌ایم."
      },
      {
        "type": "text",
        "text": "داده: ۴۲ کارنامهٔ سهمیهٔ آزاد ارشد فناوری اطلاعات (مجموعهٔ ۱۲۷۶) از ۱۴۰۵ که از تصویر خود کارنامه‌ها خوانده و هر درصدشان با تعداد تست همان سال کنترل شد. همهٔ این کارنامه‌ها رتبهٔ زیر ۱۰۰ دارند، پس این مطلب دربارهٔ رتبه‌های خوب است. کارنامهٔ ۱۴۰۵ چهار دسته‌درس داشت: زبان با ۲۵ تست، دروس مشترک با ۳۰ تست، مدیریت با ۲۰ تست و تخصصی با ۱۹ یا ۲۰ تست."
      },
      {
        "type": "heading",
        "level": 2,
        "text": "رتبه‌های خوب در هر دسته‌درس چند زدند؟"
      },
      {
        "type": "text",
        "text": "میانهٔ درصدها به تفکیک بهترین رتبهٔ هر داوطلب در دو کد آی‌تی:"
      },
      {
        "type": "table",
        "headers": [
          "گروه رتبه",
          "تعداد کارنامه",
          "زبان",
          "دروس مشترک",
          "مدیریت",
          "تخصصی"
        ],
        "rows": [
          [
            "۱ تا ۱۰",
            "۱۱",
            "۷۱",
            "۳۹",
            "۰",
            "۴۷"
          ],
          [
            "۱۱ تا ۵۰",
            "۱۳",
            "۶۰",
            "۳۰",
            "۰",
            "۴۲"
          ],
          [
            "۵۱ تا ۹۹",
            "۱۸",
            "۵۵",
            "۲۳",
            "۰",
            "۳۰"
          ]
        ]
      },
      {
        "type": "text",
        "text": "دو چیز پیداست. زبان در رتبه‌های خوب آی‌تی بسیار بالا بود: رتبه‌های زیر ۱۰ میانهٔ ۷۱ درصد زده بودند، تقریباً هم‌اندازهٔ رتبه‌های زیر ۱۰ مهندسی کامپیوتر در همان سال. و فاصلهٔ گروه‌ها بیشتر در دروس مشترک و تخصصی بود؛ از رتبه‌های ۵۱ تا ۹۹ تا رتبه‌های زیر ۱۰، میانهٔ تخصصی حدود ۱۸ واحد و میانهٔ دروس مشترک حدود ۱۶ واحد بالا رفت."
      },
      {
        "type": "heading",
        "level": 2,
        "text": "مدیریت را تقریباً همه کنار گذاشته بودند"
      },
      {
        "type": "text",
        "text": "از ۴۲ رتبهٔ زیر ۱۰۰، ۲۷ نفر مدیریت را سفید گذاشته بودند و ۳۰ نفر در آن صفر یا منفی داشتند. حتی از ۱۱ رتبهٔ زیر ۱۰، ۶ نفر آن را سفید گذاشته بودند. آن ۱۲ نفری هم که بالای صفر زده بودند، در گروه‌های مختلف میانهٔ فقط حدود ۲٫۵ تا ۵ درصد داشتند. یعنی در ۱۴۰۵ رتبهٔ خوب آی‌تی تقریباً بدون مدیریت ساخته شد."
      },
      {
        "type": "heading",
        "level": 2,
        "text": "دو کد ضریب آی‌تی"
      },
      {
        "type": "text",
        "text": "در ۱۴۰۵ داوطلب‌های ۱۲۷۶ دو رتبه داشتند: کد ۱ برای فناوری اطلاعات و کد ۲ برای آی‌تی پزشکی. در ۲۳ کارنامه کد فناوری اطلاعات بهترین رتبه را داشت، در ۱۶ کارنامه کد آی‌تی پزشکی و در ۳ کارنامه هر دو برابر بودند. به‌طور میانه، رتبهٔ بدتر حدود ۱٫۳ برابر رتبهٔ بهتر بود."
      },
      {
        "type": "heading",
        "level": 2,
        "text": "۱۴۰۶: آزمون آی‌تی عوض شده است"
      },
      {
        "type": "text",
        "text": "در جدول رسمی ۱۴۰۶، مجموعهٔ ۱۲۷۶ سه بسته دارد:"
      },
      {
        "type": "table",
        "headers": [
          "بسته",
          "مواد",
          "ضریب"
        ],
        "rows": [
          [
            "زبان",
            "زبان عمومی و تخصصی",
            "۱"
          ],
          [
            "ریاضیات",
            "ریاضیات گسسته، آمار و احتمال مهندسی",
            "۲"
          ],
          [
            "تخصصی",
            "مبانی کامپیوتر و برنامه‌سازی، داده‌ساختارها و الگوریتم‌ها، سیستم‌های عامل، شبکه‌های کامپیوتری، طراحی پایگاه داده‌ها، هوش مصنوعی",
            "۴"
          ]
        ]
      },
      {
        "type": "text",
        "text": "یعنی مدیریت، که رتبه‌های خوب ۱۴۰۵ کنارش گذاشته بودند، در فهرست ۱۴۰۶ نیست. به‌جایش ریاضیات بستهٔ جداگانه با ضریب ۲ شده است و بستهٔ تخصصی شش درس دارد. سه نتیجه برای برنامه‌ات:"
      },
      {
        "type": "text",
        "text": "• زبان را همچنان جدی بگیر. در ۱۴۰۵ رتبه‌های خوب آی‌تی در زبان بسیار قوی بودند و در ۱۴۰۶ زبان هنوز یک بستهٔ جداست.\n• ریاضیات حالا بستهٔ مستقل با ضریب ۲ است؛ برای گسسته و آمار و احتمال از همین حالا برنامه بگذار.\n• بستهٔ تخصصی ضریب ۴ دارد و شش درس را با هم می‌سنجد. داده‌ساختار و الگوریتم، سیستم عامل، شبکه و پایگاه داده ستون این بسته‌اند."
      },
      {
        "type": "heading",
        "level": 2,
        "text": "پرسش‌های پرتکرار"
      },
      {
        "type": "heading",
        "level": 3,
        "text": "رتبهٔ زیر ۱۰ ارشد آی‌تی چند درصد زده بود؟"
      },
      {
        "type": "text",
        "text": "در ۱۴۰۵، میانهٔ درصدهای ۱۱ رتبهٔ زیر ۱۰ فناوری اطلاعات در سهمیهٔ آزاد: زبان حدود ۷۱، دروس مشترک حدود ۳۹، تخصصی حدود ۴۷ و مدیریت صفر."
      },
      {
        "type": "heading",
        "level": 3,
        "text": "درس مدیریت را در ارشد آی‌تی بخوانم؟"
      },
      {
        "type": "text",
        "text": "در ۱۴۰۶ مدیریت در فهرست مواد مجموعهٔ ۱۲۷۶ نیامده است. در ۱۴۰۵ هم ۳۰ نفر از ۴۲ رتبهٔ زیر ۱۰۰ در مدیریت صفر یا منفی داشتند."
      },
      {
        "type": "heading",
        "level": 3,
        "text": "ارشد آی‌تی ۱۴۰۶ چه درس‌هایی دارد؟"
      },
      {
        "type": "text",
        "text": "زبان با ضریب ۱؛ ریاضیات گسسته و آمار و احتمال مهندسی با ضریب ۲؛ و بستهٔ تخصصی با ضریب ۴ شامل مبانی کامپیوتر و برنامه‌سازی، داده‌ساختارها و الگوریتم‌ها، سیستم‌های عامل، شبکه‌های کامپیوتری، طراحی پایگاه داده‌ها و هوش مصنوعی."
      },
      {
        "type": "heading",
        "level": 3,
        "text": "فرق ارشد آی‌تی و مهندسی کامپیوتر در کنکور ۱۴۰۶ چیست؟"
      },
      {
        "type": "text",
        "text": "مجموعهٔ ۱۲۷۷ مهندسی کامپیوتر مدار منطقی، معماری و نظریهٔ زبان‌ها و جبر خطی دارد و ۱۲۷۶ آی‌تی به‌جایشان شبکه و پایگاه داده دارد و جبر خطی ندارد. ضرایب هر دو یکی است: زبان ۱، ریاضیات ۲، تخصصی ۴."
      },
      {
        "type": "heading",
        "level": 2,
        "text": "قدم بعدی"
      },
      {
        "type": "text",
        "text": "اگر آی‌تی می‌خوانی و نمی‌دانی با تغییر ۱۴۰۶ برنامه‌ات را چطور بچینی، در مشاوره کنار هم بررسی‌اش می‌کنیم."
      },
      {
        "type": "link_group",
        "items": [
          {
            "label": "راهنمای ارشد فناوری اطلاعات ۱۴۰۶",
            "href": "/guides/master-information-technology-1406"
          },
          {
            "label": "منابع ارشد کامپیوتر ۱۴۰۶: کتاب مرجع هر درس",
            "href": "/articles/master-computer-references-1406"
          },
          {
            "label": "تحلیل کنکور ۱۴۰۵ از روی کارنامه‌ها",
            "href": "/articles/exam-1405-analysis"
          },
          {
            "label": "گرایش‌های ارشد کامپیوتر",
            "href": "/articles/master-computer-orientations"
          },
          {
            "label": "مشاوره",
            "href": "/consultations"
          }
        ]
      }
    ],
    "taxonomy": {
      "major": [
        "کامپیوتر و IT"
      ],
      "tags": [
        "کارنامه و رتبه",
        "تحلیل داده",
        "فناوری اطلاعات"
      ],
      "degrees": [
        "master"
      ],
      "fields": [
        "کامپیوتر و IT"
      ],
      "subject_codes": [],
      "topic_codes": []
    },
    "seo": {
      "title": "ارشد آی‌تی ۱۴۰۵: درصد رتبه‌های زیر ۱۰۰ و تغییر ۱۴۰۶",
      "description": "رتبه‌های زیر ۱۰ و زیر ۱۰۰ ارشد فناوری اطلاعات ۱۴۰۵ در زبان، دروس مشترک، مدیریت و تخصصی چند زدند، دو کد ضریب آی‌تی چقدر فرق داشت و آزمون آی‌تی ۱۴۰۶ چه تغییری کرده است."
    },
    "validity": {
      "exam_year": 1406,
      "time_sensitive": true,
      "source_checked_at": "2026-09-28T00:00:00.000Z",
      "review_due_at": "2026-12-15T00:00:00.000Z"
    },
    "sources": [
      {
        "source_external_id": "editorial-source-08110ffe99548a591190",
        "relation": "SUPPORTS",
        "locator": "کارنامه‌های عمومی ارشد فناوری اطلاعات ۱۴۰۵؛ فقط آمار تجمیعی",
        "claim": "میانهٔ درصدها و شمارش‌های کارنامه‌های ۱۲۷۶ در ۱۴۰۵",
        "order": 0
      },
      {
        "source_external_id": "editorial-source-50f3b52142efac0715d8",
        "relation": "SUPPORTS",
        "locator": "اطلاعیه و جدول مجموعه‌های امتحانی کارشناسی ارشد ناپیوسته سال ۱۴۰۶",
        "claim": "مواد و ضرایب مجموعهٔ ۱۲۷۶ در ۱۴۰۶",
        "order": 1
      }
    ],
    "editorial": {
      "author_slug": "mohammad-rostami"
    },
    "provenance": {
      "producer_type": "external_ai",
      "producer_name": "تحلیل داده با Claude روی پایگاه کارنامه‌های محمد رستمی؛ فقط آمار تجمیعی — نیازمند بازبینی و تأیید محمد رستمی",
      "source_artifact": "content/import-packages/articles/information-technology-1405-report-cards.mjs"
    },
    "review_status": "draft"
  }
]