[
  {
    "schema_version": "article.v2",
    "external_id": "kunkurcomputer-solutions-konkur-1405-discrete-math-solutions",
    "content_type": "article",
    "title": "پاسخ تشریحی ریاضیات گسسته کنکور ارشد مهندسی کامپیوتر ۱۴۰۵",
    "slug": "konkur-1405-discrete-math-solutions",
    "summary": "حل قدم‌به‌قدم همهٔ ۶ سؤال ریاضیات گسسته کنکور ارشد مهندسی کامپیوتر ۱۴۰۵، با کلید اولیه و نهایی و توضیح سؤال‌های حذف‌شده.",
    "quick_answer": "کنکور ارشد مهندسی کامپیوتر ۱۴۰۵ ۶ سؤال ریاضیات گسسته داشت (سؤال‌های ۴۰ تا ۴۵). کلید: ۴۰: ۱، ۴۱: ۴، ۴۲: ۲، ۴۳: ۳، ۴۴: ۱، ۴۵: ۲. حل هر سؤال در این صفحه آمده است.",
    "content_blocks": [
      {
        "type": "text",
        "text": "پاسخ تشریحی همهٔ ۶ سؤال ریاضیات گسسته کنکور کارشناسی ارشد مهندسی کامپیوتر ۱۴۰۵ (مجموعهٔ ۱۲۷۷، سؤال‌های ۴۰ تا ۴۵). صورت و گزینه‌های هر سؤال با تصویر دفترچه مقایسه شده و هر پاسخ جداگانه حل و با کلید سنجش تطبیق داده شده است. در ۱۴۰۵ کلید اولیه و نهایی در همهٔ پاسخ‌ها یکی بودند؛ فقط چند سؤال در کلید نهایی حذف شدند."
      },
      {
        "type": "heading",
        "level": 2,
        "text": "سؤال ۴۰"
      },
      {
        "type": "text",
        "text": "چند تا از اعداد ۲ تا ۱۰۰۰ مربع کامل یا مکعب کامل یا … یا به‌صورت توانی بزرگ‌تر از یک از یک عدد طبیعی است؟"
      },
      {
        "type": "text",
        "text": "۱) ۴۰\n۲) ۳۹\n۳) ۳۰\n۴) ۹"
      },
      {
        "type": "text",
        "text": "پاسخ: گزینهٔ ۱."
      },
      {
        "type": "text",
        "text": "کافی است توان‌های اول را بشماریم، چون توان مرکب از توان اول کوچک‌تر به دست می‌آید. مربع‌ها: $2^2$ تا $31^2$، یعنی ۳۰ عدد. مکعب‌ها: $2^3$ تا $10^3$، ۹ عدد که دوتایشان ($64$ و $729$، توان‌های ششم) مربع هم هستند: ۷ عدد تازه. توان پنجم: $32$ و $243$ (۲ عدد). توان هفتم: $128$ (۱ عدد). توان یازدهم به بالا از ۱۰۰۰ بیشتر است. جمع: $30+7+2+1=40$."
      },
      {
        "type": "heading",
        "level": 2,
        "text": "سؤال ۴۱"
      },
      {
        "type": "text",
        "text": "فرض کنید G یک گراف سادهٔ n رأسی باشد و به‌علاوه A ماتریس مجاورت، B ماتریس وقوع و C ماتریس قطری درجات رئوس G باشد. در این صورت کدام‌یک از روابط زیر همواره برقرار است؟"
      },
      {
        "type": "text",
        "text": "۱) $B+B^T=A+C$\n۲) $B\\cdot A=B\\cdot C$\n۳) $BB^T=A\\cdot C$\n۴) $BB^T=A+C$"
      },
      {
        "type": "text",
        "text": "پاسخ: گزینهٔ ۴."
      },
      {
        "type": "text",
        "text": "درایهٔ $(i,j)$ ماتریس $BB^T$ برابر $\\sum_e B_{ie}B_{je}$ است: تعداد یال‌هایی که هم به $i$ و هم به $j$ وصل‌اند. برای $i\\ne j$ این عدد ۱ است اگر یال $ij$ باشد و ۰ اگر نباشد، یعنی $A_{ij}$. برای $i=j$ تعداد یال‌های وصل به $i$ است، یعنی درجهٔ $i$. پس $BB^T=A+C$. (گزینهٔ ۱ اصلاً تعریف نشده، چون $B$ ماتریس $n\\times m$ است.)"
      },
      {
        "type": "heading",
        "level": 2,
        "text": "سؤال ۴۲"
      },
      {
        "type": "text",
        "text": "تابع مولد معمولی مربوط به تعداد جواب‌های صحیح و نامنفی معادلهٔ $x_1+2x_2+\\cdots+kx_k=n$ کدام است؟"
      },
      {
        "type": "text",
        "text": "۱) $\\left(\\sum_{i=0}^{\\infty}x^i\\right)+\\left(\\sum_{i=0}^{\\infty}x^{2i}\\right)+\\cdots+\\left(\\sum_{i=0}^{\\infty}x^{ki}\\right)$\n۲) $\\left(\\sum_{i=0}^{\\infty}x^i\\right)\\times\\left(\\sum_{i=0}^{\\infty}x^{2i}\\right)\\cdots\\left(\\sum_{i=0}^{\\infty}x^{ki}\\right)$\n۳) $\\left(\\sum_{i=0}^{\\infty}x^i\\right)^{1+2+\\cdots+k}$\n۴) $\\binom{n+k-1}{k-1}\\sum_{i=0}^{\\infty}x^i$"
      },
      {
        "type": "text",
        "text": "پاسخ: گزینهٔ ۲."
      },
      {
        "type": "text",
        "text": "جملهٔ $jx_j$ می‌تواند $0, j, 2j, \\dots$ باشد، پس تابع مولدش $\\sum_i x^{ji}$ است. جمع متغیرهای مستقل یعنی ضرب تابع‌های مولد: $\\prod_{j=1}^{k}\\sum_i x^{ji}$، و ضریب $x^n$ همان تعداد جواب‌هاست. (این همان تعداد افرازهای $n$ به قطعه‌هایی با اندازهٔ حداکثر $k$ است.)"
      },
      {
        "type": "heading",
        "level": 2,
        "text": "سؤال ۴۳"
      },
      {
        "type": "text",
        "text": "اگر p و q دو گزارهٔ دلخواه باشند، کدام‌یک از گزاره‌های زیر همواره درست است؟"
      },
      {
        "type": "text",
        "text": "۱) $p\\Rightarrow(\\sim p\\wedge q)$\n۲) $p\\Rightarrow\\sim(p\\vee q)$\n۳) $p\\Rightarrow(p\\vee q)$\n۴) $p\\Rightarrow(\\sim p)\\wedge(\\sim q)$"
      },
      {
        "type": "text",
        "text": "پاسخ: گزینهٔ ۳."
      },
      {
        "type": "text",
        "text": "اگر $p$ درست باشد، $p\\vee q$ هم درست است؛ پس $p\\Rightarrow(p\\vee q)$ هیچ‌وقت نادرست نمی‌شود (قاعدهٔ «افزودن»). سه گزینهٔ دیگر با $p$ درست نادرست می‌شوند."
      },
      {
        "type": "heading",
        "level": 2,
        "text": "سؤال ۴۴"
      },
      {
        "type": "text",
        "text": "تابع منطقی $f=(p_1\\oplus p_2\\oplus p_3\\oplus p_4)\\vee(p_5\\oplus p_6\\oplus p_7\\oplus p_8)$ از ۸ گزارهٔ اتمی مستقل $p_1$ تا $p_8$ تشکیل شده است. چند تابع مثل g می‌توان با این ۸ گزارهٔ اتمی ساخت به‌نحوی که $f\\to g$ تاتولوژی باشد؟"
      },
      {
        "type": "text",
        "text": "۱) $2^{64}$\n۲) $3^8$\n۳) $64!$\n۴) $C(64,8)$"
      },
      {
        "type": "text",
        "text": "پاسخ: گزینهٔ ۱."
      },
      {
        "type": "text",
        "text": "$f\\to g$ تاتولوژی است اگر هر جا $f$ درست است، $g$ هم درست باشد؛ جایی که $f$ نادرست است، $g$ آزاد است. $f$ فقط وقتی نادرست است که هر دو XOR صفر باشند. XOR چهار متغیر در ۸ حالت از ۱۶ حالت صفر است، پس $f$ در $8\\times8=64$ حالت از ۲۵۶ حالت نادرست است. $g$ روی این ۶۴ حالت آزاد است: $2^{64}$ تابع."
      },
      {
        "type": "heading",
        "level": 2,
        "text": "سؤال ۴۵"
      },
      {
        "type": "text",
        "text": "تعداد رشته‌های n بیتی ارقام صفر و یک که دقیقاً k تا صفر دارند و در آن‌ها هیچ دو صفری متوالی نیستند برابر کدام مورد است؟"
      },
      {
        "type": "text",
        "text": "۱) $C(n-k,k)$\n۲) $C(n-k+1,k)$\n۳) $C(n+k+1,k)$\n۴) $C(n+k,k)$"
      },
      {
        "type": "text",
        "text": "پاسخ: گزینهٔ ۲."
      },
      {
        "type": "text",
        "text": "اول $n-k$ یک را کنار هم بگذار. بین آن‌ها و دو سرشان $n-k+1$ جای خالی هست و هر صفر باید در یک جای جداگانه بنشیند تا دو صفر کنار هم نیفتند: $\\binom{n-k+1}{k}$."
      },
      {
        "type": "heading",
        "level": 2,
        "text": "پرسش‌های رایج"
      },
      {
        "type": "heading",
        "level": 3,
        "text": "کنکور ارشد کامپیوتر ۱۴۰۵ چند سؤال ریاضیات گسسته داشت؟"
      },
      {
        "type": "text",
        "text": "۶ سؤال، شمارهٔ ۴۰ تا ۴۵ در دفترچهٔ ۱۲۷۷."
      },
      {
        "type": "heading",
        "level": 3,
        "text": "ریاضیات گسسته در کنکور ۱۴۰۶ هست؟"
      },
      {
        "type": "text",
        "text": "بله، در بستهٔ ریاضیات با ضریب ۲ در مجموعه‌های ۱۲۷۷ و ۱۲۷۶."
      },
      {
        "type": "link_group",
        "items": [
          {
            "label": "پاسخ تشریحی همهٔ درس‌های ۱۴۰۵",
            "href": "/articles/konkur-1405-computer-engineering-solutions"
          },
          {
            "label": "صفحهٔ درس ریاضیات گسسته",
            "href": "/subjects/discrete-math"
          },
          {
            "label": "کلید کنکور ارشد کامپیوتر ۱۴۰۰ تا ۱۴۰۵",
            "href": "/articles/master-computer-answer-keys"
          },
          {
            "label": "شبیه‌ساز کنکورهای سال‌های قبل",
            "href": "/exams"
          },
          {
            "label": "درس‌نامه‌ها",
            "href": "/lesson-notes"
          }
        ]
      }
    ],
    "seo": {
      "title": "پاسخ تشریحی ریاضیات گسسته کنکور ارشد کامپیوتر ۱۴۰۵",
      "description": "حل تشریحی همهٔ سؤال‌های ریاضیات گسسته کنکور ارشد مهندسی کامپیوتر ۱۴۰۵، سؤال به سؤال، با کلید نهایی و توضیح سؤال‌های حذف‌شده."
    },
    "sources": [
      {
        "source_external_id": "editorial-source-bd8f7cb1262dd65dec24",
        "relation": "SUPPORTS",
        "locator": "دفترچهٔ سؤال و کلید کنکور کارشناسی ارشد مهندسی کامپیوتر (۱۲۷۷) ۱۴۰۵، دفترچهٔ 135A",
        "claim": "صورت، گزینه‌ها و کلید سؤال‌های ریاضیات گسسته",
        "order": 0
      },
      {
        "source_external_id": "editorial-source-08110ffe99548a591190",
        "relation": "SUPPORTS",
        "locator": "بانک سؤال کنکور کامپیوتر؛ متن هر سؤال با تصویر دفترچه مقایسه شده است",
        "claim": "کلید اولیه و نهایی و سؤال‌های حذف‌شده",
        "order": 1
      }
    ],
    "taxonomy": {
      "major": [
        "کامپیوتر و IT"
      ],
      "tags": [
        "ریاضیات گسسته",
        "پاسخ تشریحی",
        "کنکور ۱۴۰۵",
        "حل تست"
      ],
      "degrees": [
        "master"
      ],
      "fields": [
        "کامپیوتر و IT"
      ],
      "subject_codes": [
        "discrete-math"
      ],
      "topic_codes": []
    },
    "validity": {
      "exam_year": 1406,
      "time_sensitive": false,
      "source_checked_at": "2026-10-13T00:00:00.000Z"
    },
    "editorial": {
      "author_slug": "mohammad-rostami"
    },
    "provenance": {
      "producer_type": "external_ai",
      "producer_name": "حل تشریحی با Claude؛ متن هر سؤال با تصویر دفترچه مقایسه و هر پاسخ مستقل حل شده است — نیازمند بازبینی و تأیید محمد رستمی",
      "source_artifact": "content/import-packages/articles/konkur-1405-discrete-math-solutions.mjs"
    },
    "review_status": "draft"
  }
]