[
  {
    "schema_version": "article.v2",
    "external_id": "kunkurcomputer-solutions-konkur-1405-statistics-solutions",
    "content_type": "article",
    "title": "پاسخ تشریحی آمار و احتمال مهندسی کنکور ارشد مهندسی کامپیوتر ۱۴۰۵",
    "slug": "konkur-1405-statistics-solutions",
    "summary": "حل قدم‌به‌قدم همهٔ ۷ سؤال آمار و احتمال مهندسی کنکور ارشد مهندسی کامپیوتر ۱۴۰۵، با کلید اولیه و نهایی و توضیح سؤال‌های حذف‌شده.",
    "quick_answer": "کنکور ارشد مهندسی کامپیوتر ۱۴۰۵ ۷ سؤال آمار و احتمال مهندسی داشت (سؤال‌های ۳۳ تا ۳۹). کلید: ۳۳: ۱، ۳۴: ۲، ۳۵: ۴، ۳۶: ۱، ۳۷: ۴، ۳۸: ۳، ۳۹: ۴. حل هر سؤال در این صفحه آمده است.",
    "content_blocks": [
      {
        "type": "text",
        "text": "پاسخ تشریحی همهٔ ۷ سؤال آمار و احتمال مهندسی کنکور کارشناسی ارشد مهندسی کامپیوتر ۱۴۰۵ (مجموعهٔ ۱۲۷۷، سؤال‌های ۳۳ تا ۳۹). صورت و گزینه‌های هر سؤال با تصویر دفترچه مقایسه شده و هر پاسخ جداگانه حل و با کلید سنجش تطبیق داده شده است. در ۱۴۰۵ کلید اولیه و نهایی در همهٔ پاسخ‌ها یکی بودند؛ فقط چند سؤال در کلید نهایی حذف شدند."
      },
      {
        "type": "heading",
        "level": 2,
        "text": "سؤال ۳۳"
      },
      {
        "type": "text",
        "text": "تعداد راه‌های چیدمان ۵ کتاب مختلف در ۳ قفسه، به‌طوری‌که هیچ قفسه‌ای خالی نماند، کدام است؟"
      },
      {
        "type": "text",
        "text": "۱) ۱۵۰\n۲) ۲۴۰\n۳) ۳۶۰\n۴) ۵۴۰"
      },
      {
        "type": "text",
        "text": "پاسخ: گزینهٔ ۱. کلید نهایی: گزینهٔ ۱ با تأثیر مثبت (به نفع داوطلب)."
      },
      {
        "type": "text",
        "text": "اگر ترتیب کتاب‌ها روی هر قفسه مهم نباشد، این تعداد تابع‌های پوشا از ۵ کتاب به ۳ قفسه است. با اصل شمول و عدم شمول: $3^5-\\binom31 2^5+\\binom32 1^5=243-96+3=150$. اگر ترتیب روی قفسه هم مهم باشد جواب $5!\\times\\binom42=720$ می‌شود که در گزینه‌ها نیست؛ احتمالاً به همین دو برداشت، کلید نهایی به این سؤال «تأثیر مثبت» داد."
      },
      {
        "type": "heading",
        "level": 2,
        "text": "سؤال ۳۴"
      },
      {
        "type": "text",
        "text": "یک کلاس ۲۰ نفری که شامل ۱۰ دانشجوی دختر و ۱۰ دانشجوی پسر است را به دو گروه با اندازهٔ مساوی تقسیم می‌کنیم. احتمال این‌که تمامی افراد گروه‌ها از یک جنس باشند، چقدر است؟"
      },
      {
        "type": "text",
        "text": "۱) $\\frac{(10!)^2}{20!}$\n۲) $\\frac{2(10!)^2}{20!}$\n۳) $\\frac{10!}{20!}$\n۴) $\\frac12$"
      },
      {
        "type": "text",
        "text": "پاسخ: گزینهٔ ۲."
      },
      {
        "type": "text",
        "text": "گروه اول (که ۱۰ نفر دیگر گروه دوم می‌شوند) به $\\binom{20}{10}$ حالت انتخاب می‌شود. گروه‌ها تک‌جنسیتی‌اند اگر گروه اول دقیقاً همهٔ دخترها یا همهٔ پسرها باشد: ۲ حالت. احتمال $\\frac{2}{\\binom{20}{10}}=\\frac{2(10!)^2}{20!}$."
      },
      {
        "type": "heading",
        "level": 2,
        "text": "سؤال ۳۵"
      },
      {
        "type": "text",
        "text": "چهار سکهٔ سالم پرتاب می‌شوند و هر سکه‌ای که شیر آمده باشد، دوباره پرتاب می‌شود. اگر Y نشان‌دهندهٔ تعداد شیرها در پرتاب دوم باشد، P(Y = ۲) کدام است؟"
      },
      {
        "type": "text",
        "text": "۱) $\\frac12$\n۲) $\\frac34$\n۳) $\\frac{17}{128}$\n۴) $\\frac{27}{128}$"
      },
      {
        "type": "text",
        "text": "پاسخ: گزینهٔ ۴."
      },
      {
        "type": "text",
        "text": "هر سکه مستقل از بقیه فقط وقتی در پرتاب دوم شیر می‌شود که بار اول شیر بیاید و بار دوم هم شیر بیاید: احتمال $\\frac12\\cdot\\frac12=\\frac14$. پس $Y\\sim\\mathrm{Bin}(4,\\frac14)$ و $P(Y=2)=\\binom42\\left(\\frac14\\right)^2\\left(\\frac34\\right)^2=6\\cdot\\frac{9}{256}=\\frac{27}{128}$."
      },
      {
        "type": "heading",
        "level": 2,
        "text": "سؤال ۳۶"
      },
      {
        "type": "text",
        "text": "یک الگوریتم جستجو به‌طور متوسط در $\\log_2 n$ مرحله پاسخ را پیدا می‌کند. اگر $n=1024$ و واریانس مراحل جستجو ۴ باشد، احتمال این‌که الگوریتم در حداکثر ۱۲ مرحله پاسخ دهد، کدام است؟ (فرض کنید مراحل از توزیع نرمال پیروی می‌کنند.)"
      },
      {
        "type": "text",
        "text": "۱) $\\Phi(1)$\n۲) $\\Phi(-1)$\n۳) $2\\Phi(1)-1$\n۴) $1-2\\Phi(-1)$"
      },
      {
        "type": "text",
        "text": "پاسخ: گزینهٔ ۱."
      },
      {
        "type": "text",
        "text": "میانگین $\\log_2 1024=10$ و انحراف معیار $\\sqrt4=2$ است. $P(X\\le12)=P\\left(Z\\le\\frac{12-10}{2}\\right)=\\Phi(1)$."
      },
      {
        "type": "heading",
        "level": 2,
        "text": "سؤال ۳۷"
      },
      {
        "type": "text",
        "text": "تابع چگالی احتمال توأم متغیرهای تصادفی X و Y به‌صورت زیر است. $P(XY>2)$ کدام است؟\n$f_{X,Y}(x,y)=\\begin{cases}ye^{-y(x+1)} & x>0,\\ y>0\\\\ 0 & \\text{سایر نقاط}\\end{cases}$"
      },
      {
        "type": "text",
        "text": "۱) $\\frac12$\n۲) $\\frac14$\n۳) $e^{-1}$\n۴) $e^{-2}$"
      },
      {
        "type": "text",
        "text": "پاسخ: گزینهٔ ۴."
      },
      {
        "type": "text",
        "text": "چگالی را بنویس $f=e^{-y}\\cdot ye^{-yx}$: یعنی $Y\\sim\\mathrm{Exp}(1)$ و به شرط $Y=y$، $X\\sim\\mathrm{Exp}(y)$. پس $P(XY>2\\mid Y=y)=P(X>\\frac2y)=e^{-y\\cdot\\frac2y}=e^{-2}$ که به $y$ بستگی ندارد؛ در نتیجه $P(XY>2)=e^{-2}$."
      },
      {
        "type": "heading",
        "level": 2,
        "text": "سؤال ۳۸"
      },
      {
        "type": "text",
        "text": "فرض کنید هدف انجام آزمون $H_0:\\mu=0$ در مقابل $H_1:\\mu=1$ از جامعهٔ $N(\\mu,9)$ باشد. اگر ناحیهٔ بحرانی به‌صورت $\\overline X\\ge k$ تعریف شود، براساس نمونهٔ ۴ تایی $0.75,\\ 1.5,\\ -0.25,\\ -1.75$، p-مقدار کدام است؟"
      },
      {
        "type": "text",
        "text": "۱) $\\Phi(\\frac1{24})$\n۲) $1-\\Phi(\\frac1{16})$\n۳) $1-\\Phi(\\frac1{24})$\n۴) $\\Phi(\\frac1{16})$"
      },
      {
        "type": "text",
        "text": "پاسخ: گزینهٔ ۳."
      },
      {
        "type": "text",
        "text": "$\\overline x=\\frac{0.75+1.5-0.25-1.75}{4}=\\frac{0.25}{4}=\\frac1{16}$. زیر $H_0$، $\\overline X\\sim N(0,\\frac94)$ و انحراف معیارش $\\frac32$ است. p-مقدار احتمال دیدن مقداری به این بزرگی یا بزرگ‌تر است: $P(\\overline X\\ge\\frac1{16})=1-\\Phi\\left(\\frac{1/16}{3/2}\\right)=1-\\Phi(\\frac1{24})$."
      },
      {
        "type": "heading",
        "level": 2,
        "text": "سؤال ۳۹"
      },
      {
        "type": "text",
        "text": "در یک سیستم یادگیری ماشین، دقت مدل روی ۴۰۰ نمونهٔ تست، ۰٫۸ است. فاصلهٔ اطمینان ۹۵ درصدی برای دقت واقعی مدل کدام است؟ ($z_{0.975}\\simeq2$)"
      },
      {
        "type": "text",
        "text": "۱) (۰٫۷۹, ۰٫۸۱)\n۲) (۰٫۷۸, ۰٫۸۲)\n۳) (۰٫۷۷, ۰٫۸۲)\n۴) (۰٫۷۶, ۰٫۸۴)"
      },
      {
        "type": "text",
        "text": "پاسخ: گزینهٔ ۴."
      },
      {
        "type": "text",
        "text": "خطای معیار نسبت: $\\sqrt{\\frac{0.8\\times0.2}{400}}=\\sqrt{0.0004}=0.02$. فاصله: $0.8\\pm2\\times0.02=(0.76,\\ 0.84)$."
      },
      {
        "type": "heading",
        "level": 2,
        "text": "پرسش‌های رایج"
      },
      {
        "type": "heading",
        "level": 3,
        "text": "کنکور ارشد کامپیوتر ۱۴۰۵ چند سؤال آمار و احتمال مهندسی داشت؟"
      },
      {
        "type": "text",
        "text": "۷ سؤال، شمارهٔ ۳۳ تا ۳۹ در دفترچهٔ ۱۲۷۷."
      },
      {
        "type": "heading",
        "level": 3,
        "text": "آمار و احتمال مهندسی در کنکور ۱۴۰۶ هست؟"
      },
      {
        "type": "text",
        "text": "بله، در بستهٔ ریاضیات با ضریب ۲ در مجموعه‌های ۱۲۷۷ و ۱۲۷۶."
      },
      {
        "type": "link_group",
        "items": [
          {
            "label": "پاسخ تشریحی همهٔ درس‌های ۱۴۰۵",
            "href": "/articles/konkur-1405-computer-engineering-solutions"
          },
          {
            "label": "صفحهٔ درس آمار و احتمال مهندسی",
            "href": "/subjects/statistics"
          },
          {
            "label": "کلید کنکور ارشد کامپیوتر ۱۴۰۰ تا ۱۴۰۵",
            "href": "/articles/master-computer-answer-keys"
          },
          {
            "label": "شبیه‌ساز کنکورهای سال‌های قبل",
            "href": "/exams"
          },
          {
            "label": "درس‌نامه‌ها",
            "href": "/lesson-notes"
          }
        ]
      }
    ],
    "seo": {
      "title": "پاسخ تشریحی آمار و احتمال مهندسی کنکور ارشد کامپیوتر ۱۴۰۵",
      "description": "حل تشریحی همهٔ سؤال‌های آمار و احتمال مهندسی کنکور ارشد مهندسی کامپیوتر ۱۴۰۵، سؤال به سؤال، با کلید نهایی و توضیح سؤال‌های حذف‌شده."
    },
    "sources": [
      {
        "source_external_id": "editorial-source-bd8f7cb1262dd65dec24",
        "relation": "SUPPORTS",
        "locator": "دفترچهٔ سؤال و کلید کنکور کارشناسی ارشد مهندسی کامپیوتر (۱۲۷۷) ۱۴۰۵، دفترچهٔ 135A",
        "claim": "صورت، گزینه‌ها و کلید سؤال‌های آمار و احتمال مهندسی",
        "order": 0
      },
      {
        "source_external_id": "editorial-source-08110ffe99548a591190",
        "relation": "SUPPORTS",
        "locator": "بانک سؤال کنکور کامپیوتر؛ متن هر سؤال با تصویر دفترچه مقایسه شده است",
        "claim": "کلید اولیه و نهایی و سؤال‌های حذف‌شده",
        "order": 1
      }
    ],
    "taxonomy": {
      "major": [
        "کامپیوتر و IT"
      ],
      "tags": [
        "آمار و احتمال مهندسی",
        "پاسخ تشریحی",
        "کنکور ۱۴۰۵",
        "حل تست"
      ],
      "degrees": [
        "master"
      ],
      "fields": [
        "کامپیوتر و IT"
      ],
      "subject_codes": [
        "statistics"
      ],
      "topic_codes": []
    },
    "validity": {
      "exam_year": 1406,
      "time_sensitive": false,
      "source_checked_at": "2026-10-13T00:00:00.000Z"
    },
    "editorial": {
      "author_slug": "mohammad-rostami"
    },
    "provenance": {
      "producer_type": "external_ai",
      "producer_name": "حل تشریحی با Claude؛ متن هر سؤال با تصویر دفترچه مقایسه و هر پاسخ مستقل حل شده است — نیازمند بازبینی و تأیید محمد رستمی",
      "source_artifact": "content/import-packages/articles/konkur-1405-statistics-solutions.mjs"
    },
    "review_status": "draft"
  }
]