[
  {
    "schema_version": "article.v2",
    "external_id": "kunkurcomputer-data-rank-by-language-percentage",
    "content_type": "article",
    "title": "رتبه به‌ازای درصد زبان در ارشد کامپیوتر: ۸۰۳ کارنامه ۱۴۰۳ و ۱۴۰۴",
    "slug": "rank-by-language-percentage",
    "summary": "کارنامه‌های ۱۴۰۳ و ۱۴۰۴ ارشد مهندسی کامپیوتر را بر اساس درصد زبان دسته‌بندی کردیم و میانهٔ رتبه و درصد دو درس دیگر هر دسته را آوردیم.",
    "quick_answer": "در کارنامه‌های ۱۴۰۳ و ۱۴۰۴ ارشد کامپیوتر، میانهٔ بهترین رتبهٔ کارنامه‌های «صفر یا منفی» در زبان ۴۸۱ و کارنامه‌های «۶۰٪ یا بیشتر» ۲۳۵ بود. رابطهٔ زبان با رتبه در این دو سال ضعیف و تا حدی غیریکنواخت بود. این‌ها فقط کارنامه‌های منتشرشده‌اند و رابطه‌ها همبستگی‌اند، نه اثر تنهای یک درس.",
    "content_blocks": [
      {
        "type": "text",
        "text": "«زبان‌ام ضعیف است؛ چه رتبه‌ای می‌آورم؟» را از کارنامه‌های واقعی جواب می‌دهیم: کارنامه‌هایی که در زبان درصد مشخصی داشتند چه رتبه‌ای گرفتند و در بقیهٔ درس‌ها چه شکلی بودند."
      },
      {
        "type": "text",
        "text": "داده: ۸۰۳ کارنامهٔ سهمیهٔ آزاد ارشد مهندسی کامپیوتر (مجموعهٔ ۱۲۷۷) از ۱۴۰۳ (۳۴۵ کارنامه) و ۱۴۰۴ (۴۵۸) که بهترین رتبهٔ داخل سهمیه‌شان ۳۰۰۰ یا بهتر است. این دو سال را انتخاب کردیم چون تعداد تست‌هایشان معلوم و ساختارشان به ۱۴۰۶ نزدیک‌تر است. «درصد تخصصی» میانگین چهار دسته‌درس تخصصی با وزن تعداد تست همان سال است. فقط آمار تجمیعی؛ گروه‌ها دست‌کم ۱۰ کارنامه‌اند."
      },
      {
        "type": "text",
        "text": "هشدار مهم: این کارنامه‌ها همهٔ داوطلب‌ها نیستند؛ بیشتر آن‌هایی‌اند که رتبهٔ خوبی گرفته و کارنامه‌شان را منتشر کرده‌اند. پس فقط ترتیب و اندازهٔ نسبی گروه‌ها معنی دارد، نه احتمال. و چون درصدها به هم وابسته‌اند، رابطه‌ها فقط همبستگی‌اند، نه اثر تنهای یک درس."
      },
      {
        "type": "heading",
        "level": 2,
        "text": "رتبه به‌ازای درصد زبان"
      },
      {
        "type": "text",
        "text": "کارنامه‌ها را بر اساس درصد زبان دسته‌بندی کردیم و میانهٔ بهترین رتبه‌شان را آوردیم. ستون‌های آخر میانهٔ دو درس دیگر را نشان می‌دهد تا ببینی گروه‌ها در چه چیزهای دیگری فرق دارند:"
      },
      {
        "type": "table",
        "headers": [
          "درصد زبان",
          "تعداد کارنامه",
          "میانهٔ بهترین رتبه",
          "نیمهٔ وسط رتبه",
          "میانهٔ تخصصی",
          "میانهٔ ریاضی",
          "میانهٔ زبان"
        ],
        "rows": [
          [
            "صفر یا منفی",
            "۲۵۳",
            "۴۸۱",
            "۲۱۲ تا ۸۳۸",
            "۳۰٪",
            "۰٪",
            "۰٪"
          ],
          [
            "بیشتر از صفر تا ۱۰٪",
            "۹۵",
            "۴۱۶",
            "۱۷۵ تا ۱۰۶۵",
            "۲۹٪",
            "۰٪",
            "۷٪"
          ],
          [
            "۱۰ تا ۲۰٪",
            "۷۲",
            "۴۰۸",
            "۲۲۲ تا ۱۰۴۶",
            "۲۹٪",
            "۴٪",
            "۱۵٪"
          ],
          [
            "۲۰ تا ۴۰٪",
            "۱۱۸",
            "۳۵۰",
            "۱۶۸ تا ۸۱۲",
            "۳۰٪",
            "۵٪",
            "۲۹٪"
          ],
          [
            "۴۰ تا ۶۰٪",
            "۱۱۶",
            "۴۱۳",
            "۲۱۶ تا ۷۷۸",
            "۲۹٪",
            "۵٪",
            "۴۸٪"
          ],
          [
            "۶۰٪ یا بیشتر",
            "۱۴۹",
            "۲۳۵",
            "۷۷ تا ۴۹۴",
            "۳۲٪",
            "۱۰٪",
            "۷۳٪"
          ]
        ]
      },
      {
        "type": "text",
        "text": "رابطهٔ زبان با رتبه در ۱۴۰۳ و ۱۴۰۴ ضعیف و غیریکنواخت است: میانهٔ رتبه برای زبان صفر ۴۸۱ و برای ۴۰ تا ۶۰٪ ۴۱۲ است، و فقط از ۶۰٪ بالاتر به ۲۳۵ می‌رسد. میانهٔ تخصصی این گروه‌ها تقریباً یکی است (۲۹ تا ۳۲٪)، پس فاصلهٔ کم رتبه‌ها از خود زبان می‌آید. این نتیجه برای ۱۴۰۶ مطمئن نیست."
      },
      {
        "type": "heading",
        "level": 2,
        "text": "چطور از این جدول استفاده کنم؟"
      },
      {
        "type": "text",
        "text": "• درصد زبان آزمون‌های آزمایشی‌ات را پیدا کن و ردیف مربوط را بخوان؛ به «نیمهٔ وسط» نگاه کن، نه فقط میانه.\n• به دو ستون آخر هم نگاه کن: اگر درس‌های دیگرت از میانهٔ آن ردیف پایین‌تر است، رتبه‌ات معمولاً بدتر از میانه می‌شود.\n• جدول را با آزمون آزمایشی قبل از ۱۴۰۶ مقایسه نکن؛ ضرایب ۱۴۰۶ فرق دارد.\n• برای تخمین رتبه از هر شش درصد و معدل، از ابزار تخمین رتبه استفاده کن."
      },
      {
        "type": "heading",
        "level": 2,
        "text": "در ۱۴۰۶ چه چیزی عوض می‌شود؟"
      },
      {
        "type": "text",
        "text": "در ۱۴۰۶ زبان ضریب ۱ از ۷ (حدود ۱۴٪ میانگین وزنی) دارد؛ تا ۱۴۰۵ ضریب ۱ از ۱۵ (حدود ۷٪) بود، و در ۱۴۰۴ و ۱۴۰۵ درصد زبان رتبه‌های خوب هم خیلی بالا رفت. پس اثر زبان در ۱۴۰۶ از این جدول بیشتر خواهد بود؛ برای حساب دقیق مطلب «درصد زبان هر رتبه» و «ارزش هر تست در ۱۴۰۶» را ببین."
      },
      {
        "type": "heading",
        "level": 2,
        "text": "پرسش‌های پرتکرار"
      },
      {
        "type": "heading",
        "level": 3,
        "text": "با زبان صفر ارشد کامپیوتر چه رتبه‌ای می‌آید؟"
      },
      {
        "type": "text",
        "text": "در ۱۴۰۳ و ۱۴۰۴ کارنامه‌های زبان صفر یا منفی میانهٔ بهترین رتبهٔ ۴۸۱ داشتند (نیمهٔ وسط ۲۱۲ تا ۸۳۸؛ ۲۵۳ کارنامه). میانهٔ تخصصی این گروه ۳۰٪ بود."
      },
      {
        "type": "heading",
        "level": 3,
        "text": "با زبان صفر یا منفی چه رتبه‌ای می‌آوردند؟"
      },
      {
        "type": "text",
        "text": "میانهٔ بهترین رتبهٔ کارنامه‌های «صفر یا منفی» ۴۸۱ بود (نیمهٔ وسط ۲۱۲ تا ۸۳۸؛ ۲۵۳ کارنامه)."
      },
      {
        "type": "heading",
        "level": 3,
        "text": "با زبان ۶۰٪ یا بیشتر چه رتبه‌ای می‌آوردند؟"
      },
      {
        "type": "text",
        "text": "میانهٔ بهترین رتبهٔ کارنامه‌های «۶۰٪ یا بیشتر» ۲۳۵ بود (نیمهٔ وسط ۷۷ تا ۴۹۴؛ ۱۴۹ کارنامه)."
      },
      {
        "type": "heading",
        "level": 3,
        "text": "آیا این رابطه علت و معلول است؟"
      },
      {
        "type": "text",
        "text": "نه. کارنامه‌هایی که در یک درس بالاترند معمولاً در درس‌های دیگر هم بالاترند؛ جدول بالا میانهٔ دو درس دیگر را کنارش گذاشته تا ببینی."
      },
      {
        "type": "heading",
        "level": 3,
        "text": "این کارنامه‌ها همهٔ داوطلب‌ها هستند؟"
      },
      {
        "type": "text",
        "text": "نه؛ فقط کارنامه‌های منتشرشده با رتبهٔ ۳۰۰۰ یا بهتر. برای همین احتمال قبولی یا رتبه را نمی‌شود مستقیم از آن‌ها خواند."
      },
      {
        "type": "heading",
        "level": 3,
        "text": "چند کارنامه پشت این عددها است؟"
      },
      {
        "type": "text",
        "text": "۸۰۳ کارنامه از ۱۴۰۳ و ۱۴۰۴. کوچک‌ترین گروهی که در جدول آمده ۷۲ کارنامه دارد."
      },
      {
        "type": "heading",
        "level": 2,
        "text": "قدم بعدی"
      },
      {
        "type": "text",
        "text": "درصدهای آزمون‌هایت را در ابزار تخمین رتبه بزن. اگر می‌خواهی ببینی ضعف یا قوتت در کدام درس بیشتر به رتبه‌ات لطمه یا کمک می‌زند، در مشاوره کنارت هستیم."
      },
      {
        "type": "link_group",
        "items": [
          {
            "label": "ابزار تخمین رتبهٔ ارشد مهندسی کامپیوتر",
            "href": "/rank-calculator/master-computer-engineering"
          },
          {
            "label": "ارزش هر تست در ۱۴۰۶",
            "href": "/articles/value-of-a-test-1406"
          },
          {
            "label": "کدام درس را می‌شود نخواند؟",
            "href": "/articles/which-subject-to-skip"
          },
          {
            "label": "رتبهٔ زیر ۱۰۰ چند درصد می‌خواهد؟",
            "href": "/articles/top-rank-percentages"
          },
          {
            "label": "برای هر رتبه چند تست خالص لازم است؟",
            "href": "/articles/net-tests-per-rank"
          },
          {
            "label": "مشاوره",
            "href": "/consultations"
          },
          {
            "label": "راهنمای کامل: رتبه و درصد",
            "href": "/guides/master-computer-rank-and-percentage-guide"
          }
        ]
      }
    ],
    "taxonomy": {
      "major": [
        "کامپیوتر و IT"
      ],
      "tags": [
        "زبان",
        "تحلیل داده",
        "کارنامه و رتبه"
      ],
      "degrees": [
        "master"
      ],
      "fields": [
        "کامپیوتر و IT"
      ],
      "subject_codes": [],
      "topic_codes": []
    },
    "seo": {
      "title": "رتبه به‌ازای درصد زبان: ارشد کامپیوتر",
      "description": "با چند درصد زبان چه رتبه‌ای در ارشد کامپیوتر می‌آوردند؟ میانهٔ رتبه و نیمهٔ وسط هر دسته از ۸۰۳ کارنامهٔ ۱۴۰۳ و ۱۴۰۴."
    },
    "validity": {
      "exam_year": 1406,
      "time_sensitive": true,
      "source_checked_at": "2026-09-29T00:00:00.000Z",
      "review_due_at": "2026-12-15T00:00:00.000Z"
    },
    "sources": [
      {
        "source_external_id": "editorial-source-08110ffe99548a591190",
        "relation": "SUPPORTS",
        "locator": "کارنامه‌های ارشد مهندسی کامپیوتر ۱۴۰۰ تا ۱۴۰۵ کانال Konkur_answer و کارنامه‌های عمومی؛ فقط آمار تجمیعی",
        "claim": "میانهٔ رتبهٔ کارنامه‌ها به تفکیک درصد زبان",
        "order": 0
      },
      {
        "source_external_id": "editorial-source-50f3b52142efac0715d8",
        "relation": "SUPPORTS",
        "locator": "اطلاعیه و جدول مجموعه‌های امتحانی کارشناسی ارشد ناپیوسته سال ۱۴۰۶",
        "claim": "ضرایب زبان ۱، ریاضیات ۲ و بستهٔ تخصصی ۴ در مجموعهٔ ۱۲۷۷ در ۱۴۰۶",
        "order": 1
      }
    ],
    "editorial": {
      "author_slug": "mohammad-rostami"
    },
    "provenance": {
      "producer_type": "external_ai",
      "producer_name": "تحلیل داده با Claude روی پایگاه کارنامه‌های محمد رستمی؛ فقط آمار تجمیعی — نیازمند بازبینی و تأیید محمد رستمی",
      "source_artifact": "content/import-packages/articles/rank-by-language-percentage.mjs"
    },
    "review_status": "draft"
  }
]