[
  {
    "schema_version": "article.v2",
    "external_id": "kunkurcomputer-data-master-computer-kharazmi-alzahra-tabriz-malekashtar-admission",
    "content_type": "article",
    "title": "ارشد کامپیوتر خوارزمی، الزهرا، تبریز و مالک اشتر: رتبه و درصد قبولی",
    "slug": "master-computer-kharazmi-alzahra-tabriz-malekashtar-admission",
    "summary": "رتبهٔ قبولی، درصد و معدل قبول‌شده‌های روزانهٔ ارشد مهندسی کامپیوتر در چهار دانشگاه خوارزمی، الزهرا، تبریز و مالک اشتر، از ۶۷ کارنامهٔ ۱۴۰۰ تا ۱۴۰۴.",
    "quick_answer": "میانهٔ رتبهٔ قبولی روزانهٔ ارشد مهندسی کامپیوتر در خوارزمی ۴۹۲، الزهرا ۶۳۷، تبریز ۶۴۳، مالک اشتر ۶۵۳ بود (از ۶۷ کارنامه، ۱۴۰۰ تا ۱۴۰۴). قبول‌شدهٔ معمول این چهار دانشگاه میانگین چهار تخصصی ۲۱٪ تا ۲۸٪ داشت؛ در تبریز ۹۳٪ ریاضی را صفر یا منفی زده بودند.",
    "content_blocks": [
      {
        "type": "text",
        "text": "چهار دانشگاه خوارزمی، الزهرا، دانشگاه تبریز و مالک اشتر هر کدام ۱۴ تا ۱۹ کارنامهٔ قبولی روزانه در داده‌های ما دارند، پس برای هر کدام مطلب جدا نمی‌نویسیم و همه را با هم و با احتیاط می‌آوریم. این چهار دانشگاه بیشتر در رتبه‌های ۴۵۰ تا ۸۰۰ قبول می‌کنند."
      },
      {
        "type": "text",
        "text": "داده: ۶۷ کارنامهٔ قبولی روزانهٔ سهمیهٔ آزاد ارشد مهندسی کامپیوتر (خوارزمی ۱۷، الزهرا ۱۹، تبریز ۱۴، مالک اشتر ۱۷) در ۱۴۰۰ تا ۱۴۰۴. رتبه، رتبهٔ داخل سهمیه در کد ضریب گرایش قبول‌شده است. فقط آمار تجمیعی؛ گروه‌ها دست‌کم ۱۰ کارنامه‌اند و میانهٔ گرایش‌ها با دست‌کم ۵ کارنامه با ذکر تعداد آمده. کارنامه‌های منتشرشده همهٔ قبول‌شده‌ها نیستند."
      },
      {
        "type": "heading",
        "level": 2,
        "text": "رتبهٔ قبولی چهار دانشگاه"
      },
      {
        "type": "table",
        "headers": [
          "دانشگاه",
          "تعداد کارنامه",
          "میانهٔ رتبه",
          "نیمهٔ وسط",
          "گرایش‌ها (دست‌کم ۵ کارنامه)"
        ],
        "rows": [
          [
            "دانشگاه خوارزمی",
            "۱۷",
            "۴۹۲",
            "۴۷۵ تا ۶۰۹",
            "هوش مصنوعی (۱۰ کارنامه، میانهٔ ۴۸۱)"
          ],
          [
            "دانشگاه الزهرا",
            "۱۹",
            "۶۳۷",
            "۵۶۷ تا ۷۳۴",
            "نرم‌افزار (۸ کارنامه، میانهٔ ۷۵۶)؛ هوش مصنوعی (۱۱ کارنامه، میانهٔ ۵۷۹)"
          ],
          [
            "دانشگاه تبریز",
            "۱۴",
            "۶۴۳",
            "۵۷۸ تا ۷۸۸",
            "هوش مصنوعی (۹ کارنامه، میانهٔ ۶۳۹)"
          ],
          [
            "دانشگاه صنعتی مالک اشتر",
            "۱۷",
            "۶۵۳",
            "۶۴۰ تا ۸۲۰",
            "رایانش امن (۷ کارنامه، میانهٔ ۶۴۷)؛ هوش مصنوعی (۶ کارنامه، میانهٔ ۶۶۹)"
          ]
        ]
      },
      {
        "type": "text",
        "text": "از نظر میانهٔ رتبه، دانشگاه خوارزمی (۴۹۲) رقابتی‌ترین و دانشگاه صنعتی مالک اشتر (۶۵۳) آسان‌ترین این چهار دانشگاه است. در همهٔ ۱۵ دانشگاهی که دست‌کم ۱۰ کارنامه دارند، این چهار خوارزمی ۹‌ام، الزهرا ۱۱‌ام، تبریز ۱۲‌ام، مالک اشتر ۱۴‌ام هستند."
      },
      {
        "type": "heading",
        "level": 2,
        "text": "کارنامهٔ معمول قبول‌شده‌ها"
      },
      {
        "type": "table",
        "headers": [
          "درس",
          "خوارزمی",
          "الزهرا",
          "تبریز",
          "مالک اشتر"
        ],
        "rows": [
          [
            "زبان",
            "۰٪",
            "۹٪",
            "۱۳٪",
            "۰٪"
          ],
          [
            "ریاضی",
            "۰٪",
            "۰٪",
            "۰٪",
            "۰٪"
          ],
          [
            "نظریه و سیگنال",
            "۳۳٪",
            "۱۹٪",
            "۲۳٪",
            "۱۷٪"
          ],
          [
            "داده‌ساختار، الگوریتم و هوش",
            "۱۸٪",
            "۲۰٪",
            "۱۵٪",
            "۱۳٪"
          ],
          [
            "منطقی و معماری",
            "۳۰٪",
            "۲۷٪",
            "۲۲٪",
            "۳۵٪"
          ],
          [
            "سیستم عامل، شبکه و پایگاه داده",
            "۳۲٪",
            "۲۶٪",
            "۲۹٪",
            "۳۰٪"
          ],
          [
            "میانگین چهار تخصصی",
            "۲۸٪",
            "۲۲٪",
            "۲۱٪",
            "۲۵٪"
          ],
          [
            "معدل (میانه)",
            "۱۷٫۹",
            "۱۷٫۹",
            "۱۷٫۲",
            "۱۷٫۵"
          ],
          [
            "معدل زیر ۱۶",
            "۱۲٪",
            "۵٪",
            "۲۹٪",
            "۲۴٪"
          ],
          [
            "ریاضی صفر یا منفی",
            "۵۳٪",
            "۷۴٪",
            "۹۳٪",
            "۵۹٪"
          ],
          [
            "زبان صفر یا منفی",
            "۵۹٪",
            "۳۲٪",
            "۲۹٪",
            "۵۹٪"
          ]
        ]
      },
      {
        "type": "text",
        "text": "نکتهٔ برجسته: در تبریز ۹۳٪ قبول‌شده‌ها ریاضی را صفر یا منفی زده بودند (از ۱۴ کارنامه) و در خوارزمی و مالک اشتر ۵۹٪ زبان را. میانگین چهار تخصصی این دانشگاه‌ها ۲۱٪ تا ۲۸٪ است؛ کمتر از دانشگاه‌های بزرگ تهران."
      },
      {
        "type": "heading",
        "level": 2,
        "text": "سهمیهٔ ۵٪ و دوره‌های دیگر"
      },
      {
        "type": "text",
        "text": "برای خوارزمی (۵ کارنامه، میانهٔ رتبهٔ داخل سهمیه ۱۵۲)، تبریز (۶ کارنامه، میانهٔ رتبهٔ داخل سهمیه ۲۲۳) کارنامهٔ قبولی سهمیهٔ ۵٪ هم داریم؛ رتبهٔ داخل سهمیه را نمی‌شود با رتبهٔ آزاد مقایسه کرد. برای خوارزمی دورهٔ شبانه یا پردیس هم داریم."
      },
      {
        "type": "heading",
        "level": 2,
        "text": "پرسش‌های پرتکرار"
      },
      {
        "type": "heading",
        "level": 3,
        "text": "رتبهٔ قبولی ارشد کامپیوتر دانشگاه خوارزمی چند است؟"
      },
      {
        "type": "text",
        "text": "میانهٔ رتبهٔ قبولی روزانهٔ سهمیهٔ آزاد ۴۹۲ بود (۱۷ کارنامه؛ نیمهٔ وسط ۴۷۵ تا ۶۰۹)."
      },
      {
        "type": "heading",
        "level": 3,
        "text": "رتبهٔ قبولی ارشد کامپیوتر دانشگاه الزهرا چند است؟"
      },
      {
        "type": "text",
        "text": "میانهٔ رتبهٔ قبولی روزانهٔ سهمیهٔ آزاد ۶۳۷ بود (۱۹ کارنامه؛ نیمهٔ وسط ۵۶۷ تا ۷۳۴)."
      },
      {
        "type": "heading",
        "level": 3,
        "text": "رتبهٔ قبولی ارشد کامپیوتر دانشگاه تبریز چند است؟"
      },
      {
        "type": "text",
        "text": "میانهٔ رتبهٔ قبولی روزانهٔ سهمیهٔ آزاد ۶۴۳ بود (۱۴ کارنامه؛ نیمهٔ وسط ۵۷۸ تا ۷۸۸)."
      },
      {
        "type": "heading",
        "level": 3,
        "text": "رتبهٔ قبولی ارشد کامپیوتر دانشگاه صنعتی مالک اشتر چند است؟"
      },
      {
        "type": "text",
        "text": "میانهٔ رتبهٔ قبولی روزانهٔ سهمیهٔ آزاد ۶۵۳ بود (۱۷ کارنامه؛ نیمهٔ وسط ۶۴۰ تا ۸۲۰)."
      },
      {
        "type": "heading",
        "level": 3,
        "text": "این چهار دانشگاه رتبه‌های چند را قبول می‌کنند؟"
      },
      {
        "type": "text",
        "text": "میانهٔ رتبهٔ قبولی‌شان از ۴۹۲ تا ۶۵۳ است؛ یعنی بیشتر رتبه‌های حدود ۴۵۰ تا ۷۰۰. برای رتبه‌های بهتر، «رتبهٔ ۳۰۰ تا ۱۰۰۰» و «رتبهٔ ۵۰۰» را ببین."
      },
      {
        "type": "heading",
        "level": 3,
        "text": "چند کارنامه پشت این عددها است؟"
      },
      {
        "type": "text",
        "text": "۶۷ کارنامهٔ قبولی روزانه: خوارزمی ۱۷، الزهرا ۱۹، تبریز ۱۴، مالک اشتر ۱۷. با این تعداد، عددها فقط نشانه‌اند."
      },
      {
        "type": "heading",
        "level": 2,
        "text": "قدم بعدی"
      },
      {
        "type": "text",
        "text": "رتبه‌ات را با ابزار تخمین رتبه بسنج و ببین به کدام یک از این دانشگاه‌ها نزدیک‌تر است. برای انتخاب دانشگاه و گرایش هم در مشاوره کنارت هستیم."
      },
      {
        "type": "link_group",
        "items": [
          {
            "label": "ابزار تخمین رتبهٔ ارشد مهندسی کامپیوتر",
            "href": "/rank-calculator/master-computer-engineering"
          },
          {
            "label": "رتبهٔ قبولی ارشد کامپیوتر به تفکیک دانشگاه",
            "href": "/articles/admitted-ranks-by-university"
          },
          {
            "label": "رتبه‌های ۳۰۰ تا ۱۰۰۰: کجا قبول می‌شوند؟",
            "href": "/articles/rank-300-to-1000-admissions"
          },
          {
            "label": "رتبهٔ ۵۰۰ ارشد کامپیوتر",
            "href": "/articles/master-computer-rank-500-report-card"
          },
          {
            "label": "گرایش‌های ارشد کامپیوتر",
            "href": "/articles/master-computer-orientations"
          },
          {
            "label": "مشاوره",
            "href": "/consultations"
          }
        ]
      }
    ],
    "taxonomy": {
      "major": [
        "کامپیوتر و IT"
      ],
      "tags": [
        "دانشگاه‌ها",
        "رتبهٔ قبولی",
        "کارنامه و رتبه"
      ],
      "degrees": [
        "master"
      ],
      "fields": [
        "کامپیوتر و IT"
      ],
      "subject_codes": [],
      "topic_codes": []
    },
    "seo": {
      "title": "ارشد کامپیوتر خوارزمی، الزهرا، تبریز، مالک اشتر: رتبه",
      "description": "رتبهٔ قبولی، درصد و معدل قبول‌شده‌های روزانهٔ ارشد مهندسی کامپیوتر در دانشگاه‌های خوارزمی، الزهرا، تبریز و مالک اشتر؛ از کارنامه‌های ۱۴۰۰ تا ۱۴۰۴."
    },
    "validity": {
      "exam_year": 1406,
      "time_sensitive": false
    },
    "sources": [
      {
        "source_external_id": "editorial-source-08110ffe99548a591190",
        "relation": "SUPPORTS",
        "locator": "کارنامه‌های ارشد مهندسی کامپیوتر ۱۴۰۰ تا ۱۴۰۵ کانال Konkur_answer و کارنامه‌های عمومی؛ فقط آمار تجمیعی",
        "claim": "رتبه، درصد و معدل قبول‌شده‌های روزانهٔ خوارزمی، الزهرا، تبریز و مالک اشتر",
        "order": 0
      }
    ],
    "editorial": {
      "author_slug": "mohammad-rostami"
    },
    "provenance": {
      "producer_type": "external_ai",
      "producer_name": "تحلیل داده با Claude روی پایگاه کارنامه‌های محمد رستمی؛ فقط آمار تجمیعی — نیازمند بازبینی و تأیید محمد رستمی",
      "source_artifact": "content/import-packages/articles/master-computer-kharazmi-alzahra-tabriz-malekashtar-admission.mjs"
    },
    "review_status": "draft"
  }
]