[
  {
    "schema_version": "article.v2",
    "external_id": "kunkurcomputer-data-top-100-report-card-types",
    "content_type": "article",
    "title": "رتبه‌های زیر ۱۰۰ ارشد کامپیوتر چهار نوع کارنامه دارند: ریاضی و زبان چطور؟",
    "slug": "top-100-report-card-types",
    "summary": "رتبه‌های ۱ تا ۱۰۰ ارشد مهندسی کامپیوتر را بر اساس قوی یا ضعیف بودن ریاضی و زبان به چهار نوع کارنامه تقسیم کردیم: سهم هر نوع، رتبه و درصدهایش و تغییرش در ۱۴۰۰ تا ۱۴۰۵.",
    "quick_answer": "در کارنامه‌های ۱۴۰۰ تا ۱۴۰۵، ۳۱٪ رتبه‌های ۱ تا ۱۰۰ ریاضی (زیر ۱۵٪) و زبان (زیر ۳۰٪) هر دو را ضعیف داشتند و ۳۱٪ هر دو را قوی. این ترکیب عوض شد: ریاضی و زبانِ هر دو ضعیف از ۴۲٪ در ۱۴۰۰ تا ۱۴۰۳ به ۱۲٪ در ۱۴۰۴ و ۱۴۰۵ رسید و هر دو قوی از ۱۸٪ به ۵۱٪.",
    "content_blocks": [
      {
        "type": "text",
        "text": "«برای رتبهٔ زیر ۱۰۰ باید همه‌چیز قوی باشد؟» نه لزوماً. کارنامهٔ رتبه‌های زیر ۱۰۰ همه شبیه هم نیست: بعضی با ریاضی و زبان قوی آمده‌اند، بعضی با هر دو ضعیف. اینجا این تنوع را با عدد نشان می‌دهیم و می‌بینیم در شش سال چطور عوض شده."
      },
      {
        "type": "text",
        "text": "داده: ۲۷۲ کارنامهٔ سهمیهٔ آزاد ارشد مهندسی کامپیوتر (مجموعهٔ ۱۲۷۷) از ۱۴۰۰ تا ۱۴۰۵ که بهترین رتبهٔ داخل سهمیه‌شان ۱ تا ۱۰۰ است. هر کارنامه را با دو آستانه به یکی از چهار نوع تقسیم کردیم: ریاضی «قوی» یعنی ۱۵٪ یا بیشتر و زبان «قوی» یعنی ۳۰٪ یا بیشتر. آستانه‌ها عدد گرد و نزدیک میانهٔ همین گروه‌اند و قانون رسمی نیستند. فقط آمار تجمیعی؛ گروه‌ها دست‌کم ۱۰ کارنامه‌اند."
      },
      {
        "type": "heading",
        "level": 2,
        "text": "چهار نوع کارنامه"
      },
      {
        "type": "table",
        "headers": [
          "نوع کارنامه",
          "تعداد",
          "سهم",
          "میانهٔ رتبه",
          "میانگین چهار تخصصی",
          "میانهٔ ریاضی",
          "میانهٔ زبان",
          "میانهٔ معدل"
        ],
        "rows": [
          [
            "ریاضی و زبان هر دو قوی",
            "۸۳",
            "۳۱٪",
            "۳۱",
            "۴۷٪",
            "۲۷٪",
            "۶۷٪",
            "۱۸٫۷"
          ],
          [
            "فقط ریاضی قوی",
            "۴۶",
            "۱۷٪",
            "۳۹",
            "۴۸٪",
            "۲۴٪",
            "۵٪",
            "۱۸٫۵"
          ],
          [
            "فقط زبان قوی",
            "۶۰",
            "۲۲٪",
            "۵۰",
            "۴۶٪",
            "۷٪",
            "۵۳٪",
            "۱۸٫۲"
          ],
          [
            "ریاضی و زبان هر دو ضعیف",
            "۸۳",
            "۳۱٪",
            "۶۰",
            "۴۳٪",
            "۰٪",
            "۰٪",
            "۱۸٫۲"
          ]
        ]
      },
      {
        "type": "text",
        "text": "بزرگ‌ترین گروه‌ها «هر دو ضعیف» و «هر دو قوی» هستند (هر کدام ۸۳ از ۲۷۲ کارنامه، حدود ۳۱٪). میانهٔ رتبهٔ هر دو قوی ۳۱ و هر دو ضعیف ۶۰ است، ولی میانگین چهار تخصصی این دو گروه نزدیک است (۴۷٪ و ۴۳٪): یعنی تخصصی ثابت مانده و ریاضی و زبان فاصلهٔ رتبه را تا حدی می‌سازند. «فقط زبان قوی» ۶۰ کارنامه و «فقط ریاضی قوی» ۴۶ کارنامه دارد."
      },
      {
        "type": "heading",
        "level": 2,
        "text": "این ترکیب در سال‌ها عوض شد"
      },
      {
        "type": "text",
        "text": "سهم هر نوع در ۱۴۰۰ تا ۱۴۰۳ (۱۷۱ کارنامه) و در ۱۴۰۴ و ۱۴۰۵ (۱۰۱ کارنامه):"
      },
      {
        "type": "table",
        "headers": [
          "نوع کارنامه",
          "۱۴۰۰ تا ۱۴۰۳",
          "۱۴۰۴ و ۱۴۰۵"
        ],
        "rows": [
          [
            "ریاضی و زبان هر دو قوی",
            "۳۱ کارنامه (۱۸٪)",
            "۵۲ کارنامه (۵۱٪)"
          ],
          [
            "فقط ریاضی قوی",
            "۳۲ کارنامه (۱۹٪)",
            "۱۴ کارنامه (۱۴٪)"
          ],
          [
            "فقط زبان قوی",
            "۳۷ کارنامه (۲۲٪)",
            "۲۳ کارنامه (۲۳٪)"
          ],
          [
            "ریاضی و زبان هر دو ضعیف",
            "۷۱ کارنامه (۴۲٪)",
            "۱۲ کارنامه (۱۲٪)"
          ]
        ]
      },
      {
        "type": "text",
        "text": "در ۱۴۰۰ تا ۱۴۰۳ حدود ۴۲٪ رتبه‌های زیر ۱۰۰ ریاضی و زبان هر دو را ضعیف داشتند (۷۱ از ۱۷۱)؛ در ۱۴۰۴ و ۱۴۰۵ فقط ۱۲٪ (۱۲ از ۱۰۱). در همین مدت «هر دو قوی» از ۱۸٪ به ۵۱٪ رسید. یعنی نوع غالب کارنامهٔ رتبهٔ زیر ۱۰۰ از «تخصصی‌محور» به «همه‌چیز قوی» رفته است."
      },
      {
        "type": "heading",
        "level": 2,
        "text": "از این تقسیم‌بندی چه بگیریم؟"
      },
      {
        "type": "text",
        "text": "• اگر ریاضی و زبانت ضعیف است، رتبهٔ زیر ۱۰۰ در سال‌های قبل ممکن بود (میانهٔ رتبه ۶۰)، ولی بیشتر این کارنامه‌ها مال ۱۴۰۰ تا ۱۴۰۳ است و در ۱۴۰۴ و ۱۴۰۵ کم شده‌اند.\n• از ۱۴۰۴ حدود نیمی از رتبه‌های زیر ۱۰۰ هر دو را قوی داشتند؛ اگر هدفت زیر ۱۰۰ است، ریاضی و زبان را کنار نگذار.\n• ضرایب ۱۴۰۶ (ریاضی ۲ و زبان ۱ از ۷) این روند را تشدید می‌کند؛ مطلب «ضرایب ۱۴۰۶: چه کسانی جلو می‌افتند؟» را ببین.\n• تخصصی همچنان پایهٔ همه‌چیز است: میانگین تخصصی در هر چهار نوع ۴۳ تا ۴۸٪ بود."
      },
      {
        "type": "heading",
        "level": 2,
        "text": "پرسش‌های پرتکرار"
      },
      {
        "type": "heading",
        "level": 3,
        "text": "رتبه‌های ۱ تا ۱۰۰ بیشتر چه کارنامه‌ای دارند؟"
      },
      {
        "type": "text",
        "text": "بزرگ‌ترین گروه «ریاضی و زبان هر دو قوی» است: ۸۳ از ۲۷۲ کارنامه (۳۱٪)."
      },
      {
        "type": "heading",
        "level": 3,
        "text": "چند درصد رتبه‌های ۱ تا ۱۰۰ ریاضی و زبان هر دو را ضعیف دارند؟"
      },
      {
        "type": "text",
        "text": "۳۱٪ در کل شش سال؛ ۴۲٪ در ۱۴۰۰ تا ۱۴۰۳ و ۱۲٪ در ۱۴۰۴ و ۱۴۰۵."
      },
      {
        "type": "heading",
        "level": 3,
        "text": "چند درصد هر دو را قوی دارند؟"
      },
      {
        "type": "text",
        "text": "۳۱٪ در کل؛ ۱۸٪ در ۱۴۰۰ تا ۱۴۰۳ و ۵۱٪ در ۱۴۰۴ و ۱۴۰۵."
      },
      {
        "type": "heading",
        "level": 3,
        "text": "ریاضی قوی و زبان ضعیف چطور؟"
      },
      {
        "type": "text",
        "text": "۱۷٪ کارنامه‌ها؛ میانهٔ رتبه‌شان ۳۹."
      },
      {
        "type": "heading",
        "level": 3,
        "text": "این آستانه‌ها معیار رسمی‌اند؟"
      },
      {
        "type": "text",
        "text": "نه. ریاضی ۱۵٪ و زبان ۳۰٪ را چون نزدیک میانهٔ همین گروه‌اند انتخاب کردیم؛ آستانه‌های دیگر تقسیم را کمی عوض می‌کند."
      },
      {
        "type": "heading",
        "level": 3,
        "text": "چند کارنامه پشت این عددها است؟"
      },
      {
        "type": "text",
        "text": "۲۷۲ کارنامه (۱۷۱ از ۱۴۰۰ تا ۱۴۰۳ و ۱۰۱ از ۱۴۰۴ و ۱۴۰۵). نمونه فقط کارنامه‌های منتشرشده است."
      },
      {
        "type": "heading",
        "level": 2,
        "text": "قدم بعدی"
      },
      {
        "type": "text",
        "text": "ببین کارنامه‌ات به کدام نوع نزدیک‌تر است و با ضرایب ۱۴۰۶ چه تغییری می‌کند. برای برنامه‌ریزی بر اساس نوع کارنامه‌ات در مشاوره کنارت هستیم."
      },
      {
        "type": "link_group",
        "items": [
          {
            "label": "ابزار تخمین رتبهٔ ارشد مهندسی کامپیوتر",
            "href": "/rank-calculator/master-computer-engineering"
          },
          {
            "label": "ضرایب ۱۴۰۶: چه کسانی جلو می‌افتند؟",
            "href": "/articles/who-wins-under-1406-weights"
          },
          {
            "label": "کدام درس را می‌شود نخواند؟",
            "href": "/articles/which-subject-to-skip"
          },
          {
            "label": "درصد زبان هر رتبه",
            "href": "/articles/language-percentage-by-rank"
          },
          {
            "label": "رتبهٔ زیر ۱۰۰ چند درصد می‌خواهد؟",
            "href": "/articles/top-rank-percentages"
          },
          {
            "label": "مشاوره",
            "href": "/consultations"
          }
        ]
      }
    ],
    "taxonomy": {
      "major": [
        "کامپیوتر و IT"
      ],
      "tags": [
        "ریاضی",
        "زبان",
        "تحلیل داده",
        "کارنامه و رتبه"
      ],
      "degrees": [
        "master"
      ],
      "fields": [
        "کامپیوتر و IT"
      ],
      "subject_codes": [],
      "topic_codes": []
    },
    "seo": {
      "title": "رتبهٔ زیر ۱۰۰ ارشد کامپیوتر: چهار نوع کارنامه",
      "description": "رتبه‌های ۱ تا ۱۰۰ ارشد مهندسی کامپیوتر چه نوع کارنامه‌ای دارند؟ چهار نوع بر اساس ریاضی و زبان، سهم و درصدهای هر نوع و تغییر ۱۴۰۰ تا ۱۴۰۵."
    },
    "validity": {
      "exam_year": 1406,
      "time_sensitive": true,
      "source_checked_at": "2026-09-29T00:00:00.000Z",
      "review_due_at": "2026-12-15T00:00:00.000Z"
    },
    "sources": [
      {
        "source_external_id": "editorial-source-08110ffe99548a591190",
        "relation": "SUPPORTS",
        "locator": "کارنامه‌های ارشد مهندسی کامپیوتر ۱۴۰۰ تا ۱۴۰۵ کانال Konkur_answer و کارنامه‌های عمومی؛ فقط آمار تجمیعی",
        "claim": "سهم و میانه‌های چهار نوع کارنامه در رتبه‌های ۱ تا ۱۰۰",
        "order": 0
      }
    ],
    "editorial": {
      "author_slug": "mohammad-rostami"
    },
    "provenance": {
      "producer_type": "external_ai",
      "producer_name": "تحلیل داده با Claude روی پایگاه کارنامه‌های محمد رستمی؛ فقط آمار تجمیعی — نیازمند بازبینی و تأیید محمد رستمی",
      "source_artifact": "content/import-packages/articles/top-100-report-card-types.mjs"
    },
    "review_status": "draft"
  }
]